{
  "$schema": "http://json-schema.org/draft-07/schema#",
  "$id": "https://github.com/myq0721/china-food-map/data/schema/restaurant.schema.json",
  "title": "Restaurant",
  "type": "object",
  "required": ["id", "city", "name", "createdAt", "updatedAt", "recommenders"],
  "additionalProperties": false,
  "properties": {
    "id": {
      "type": "string",
      "pattern": "^[a-z0-9]+(-[a-z0-9]+)*$"
    },
    "city": { "type": "string", "minLength": 1 },
    "name": { "type": "string", "minLength": 1 },
    "cuisine": {
      "type": "array",
      "items": { "type": "string", "minLength": 1 }
    },
    "address": { "type": "string" },
    "coordinates": {
      "oneOf": [
        { "type": "null" },
        {
          "type": "array",
          "items": { "type": "number" },
          "minItems": 2,
          "maxItems": 2
        }
      ]
    },
    "createdAt": { "type": "string", "format": "date-time" },
    "updatedAt": { "type": "string", "format": "date-time" },
    "recommenders": {
      "type": "array",
      "minItems": 1,
      "items": { "$ref": "#/$defs/recommender" }
    }
  },
  "$defs": {
    "dish": {
      "type": "object",
      "required": ["name"],
      "additionalProperties": false,
      "properties": {
        "name": { "type": "string", "minLength": 1 },
        "price": { "type": "string" }
      }
    },
    "comment": {
      "type": "object",
      "required": ["author", "text"],
      "additionalProperties": false,
      "properties": {
        "author": { "type": "string", "minLength": 1 },
        "text": { "type": "string", "minLength": 1 }
      }
    },
    "recommender": {
      "type": "object",
      "required": ["authorId", "platform", "recommendedAt"],
      "additionalProperties": false,
      "properties": {
        "authorId": { "type": "string", "minLength": 1 },
        "platform": {
          "type": "string",
          "enum": ["github", "twitter", "douyin", "bilibili"]
        },
        "profileUrl": { "type": "string", "format": "uri" },
        "recommendedAt": { "type": "string", "format": "date" },
        "dishes": {
          "type": "array",
          "items": { "$ref": "#/$defs/dish" }
        },
        "reason": { "type": "string" },
        "comments": {
          "type": "array",
          "items": { "$ref": "#/$defs/comment" }
        },
        "sourceVideoUrl": { "type": "string", "format": "uri" }
      }
    }
  }
}
