{
  "id": "beijing-kaorouji",
  "city": "北京",
  "name": "烤肉季",
  "cuisine": ["鲁菜"],
  "address": "西城区什刹海前海东沿14号",
  "coordinates": null,
  "createdAt": "2026-06-13T08:00:00.000Z",
  "updatedAt": "2026-06-14T08:00:00.000Z",
  "recommenders": [
    {
      "authorId": "beijinglocal",
      "platform": "github",
      "profileUrl": "https://github.com/beijinglocal",
      "recommendedAt": "2026-06-13",
      "dishes": [{ "name": "烤羊肉", "price": "98元" }],
      "reason": "老字号涮烤，什刹海观景吃饭两不误。"
    }
  ]
}
