{
  "id": "guangzhou-panxi-restaurant",
  "city": "广州",
  "name": "泮溪酒家",
  "cuisine": ["粤菜"],
  "address": "荔湾区龙津西路151号",
  "coordinates": null,
  "createdAt": "2026-06-12T08:00:00.000Z",
  "updatedAt": "2026-06-17T08:00:00.000Z",
  "recommenders": [
    {
      "authorId": "yuefan",
      "platform": "github",
      "profileUrl": "https://github.com/yuefan",
      "recommendedAt": "2026-06-12",
      "dishes": [{ "name": "虾饺", "price": "36元" }],
      "reason": "早茶经典，园林环境很好。"
    },
    {
      "authorId": "dimsumking",
      "platform": "github",
      "profileUrl": "https://github.com/dimsumking",
      "recommendedAt": "2026-06-17",
      "dishes": [
        { "name": "叉烧包", "price": "28元" },
        { "name": "凤爪", "price": "32元" }
      ],
      "reason": "点心新鲜，适合周末家庭早茶。"
    }
  ]
}
