{
  "id": "chengdu-chen-mapo-doufu",
  "city": "成都",
  "name": "陈麻婆豆腐",
  "cuisine": ["川菜"],
  "address": "青羊区西玉龙街197号",
  "coordinates": null,
  "createdAt": "2026-06-11T08:00:00.000Z",
  "updatedAt": "2026-06-15T09:00:00.000Z",
  "recommenders": [
    {
      "authorId": "chuanweidao",
      "platform": "github",
      "profileUrl": "https://github.com/chuanweidao",
      "recommendedAt": "2026-06-11",
      "dishes": [{ "name": "麻婆豆腐", "price": "32元" }],
      "reason": "麻辣鲜香，下饭神器，正宗川味。"
    },
    {
      "authorId": "spicylover",
      "platform": "github",
      "profileUrl": "https://github.com/spicylover",
      "recommendedAt": "2026-06-15",
      "dishes": [
        { "name": "宫保鸡丁", "price": "38元" },
        { "name": "夫妻肺片", "price": "42元" }
      ],
      "reason": "游客很多但出品依旧稳定。"
    }
  ]
}
