{
  "id": "shanghai-nanxiang-mantou",
  "city": "上海",
  "name": "南翔馒头店",
  "cuisine": ["苏菜"],
  "address": "黄浦区豫园路85号",
  "coordinates": null,
  "createdAt": "2026-06-14T08:00:00.000Z",
  "updatedAt": "2026-06-16T08:00:00.000Z",
  "recommenders": [
    {
      "authorId": "shanghaitaste",
      "platform": "github",
      "profileUrl": "https://github.com/shanghaitaste",
      "recommendedAt": "2026-06-14",
      "dishes": [{ "name": "小笼包", "price": "48元" }],
      "reason": "皮薄汁多，豫园逛吃必打卡。"
    },
    {
      "authorId": "soupbao",
      "platform": "github",
      "profileUrl": "https://github.com/soupbao",
      "recommendedAt": "2026-06-16",
      "reason": "建议点蟹粉小笼，鲜甜不腻。"
    }
  ]
}
