{
  "id": "hangzhou-hangzhou-jiujia",
  "city": "杭州",
  "name": "杭州酒家",
  "cuisine": ["浙菜", "杭帮菜"],
  "address": "上城区延安路XXX号",
  "coordinates": null,
  "createdAt": "2026-06-10T08:00:00.000Z",
  "updatedAt": "2026-06-16T10:00:00.000Z",
  "recommenders": [
    {
      "authorId": "lianyi",
      "platform": "github",
      "profileUrl": "https://github.com/lianyi",
      "recommendedAt": "2026-06-10",
      "dishes": [{ "name": "东坡肉", "price": "68元" }],
      "reason": "老字号杭帮菜，味道稳定，适合带朋友来。"
    },
    {
      "authorId": "shidunzi",
      "platform": "github",
      "profileUrl": "https://github.com/shidunzi",
      "recommendedAt": "2026-06-12",
      "dishes": [{ "name": "西湖醋鱼", "price": "88元" }],
      "reason": "醋鱼酸甜适中，周末建议早点到。",
      "comments": [{ "author": "mono", "text": "排队大概半小时，值得。" }]
    },
    {
      "authorId": "mono",
      "platform": "github",
      "profileUrl": "https://github.com/mono",
      "recommendedAt": "2026-06-14",
      "reason": "环境有江南韵味，适合家庭聚餐。"
    },
    {
      "authorId": "foodie_hangzhou",
      "platform": "github",
      "profileUrl": "https://github.com/foodie_hangzhou",
      "recommendedAt": "2026-06-16",
      "dishes": [{ "name": "叫花鸡", "price": "128元" }]
    }
  ]
}
